{
  "$schema": "https://json-schema.org/draft/2020-12/schema",
  "title": "MentalWellnessSessionCredential (Non-PHI)",
  "description": "Attendance proof for a mental wellness session without PHI.",
  "type": "object",
  "properties": {
    "@context": {
      "type": "array",
      "minItems": 1
    },
    "type": {
      "type": "array",
      "contains": {
        "type": "string",
        "pattern": "^VerifiableCredential$"
      }
    },
    "issuer": {
      "type": ["string", "object"]
    },
    "issuanceDate": {
      "type": "string",
      "format": "date-time"
    },
    "credentialSubject": {
      "type": "object",
      "properties": {
        "subjectId": {
          "type": "string",
          "description": "Pseudonymous subject identifier (e.g., DID or UUID)."
        },
        "sessionDate": {
          "type": "string",
          "format": "date"
        },
        "sessionType": {
          "type": "string",
          "enum": ["education", "coaching", "group_support", "guided_relaxation"]
        },
        "sessionLevel": {
          "type": "string",
          "enum": ["L1", "L2", "L3"]
        }
      },
      "required": ["subjectId", "sessionDate", "sessionType", "sessionLevel"],
      "additionalProperties": false
    },
    "proof": {
      "type": "object"
    }
  },
  "required": ["@context", "type", "issuer", "issuanceDate", "credentialSubject", "proof"],
  "additionalProperties": true
}
