{"@context":["https://www.w3.org/2018/credentials/v1"],"type":["VerifiableCredential","MentalWellnessSessionCredential"],"issuer":"did:example:issuer123","issuanceDate":"2025-08-12T00:00:00Z","credentialSubject":{"subjectId":"did:example:person789","sessionDate":"2025-08-01","sessionType":"guided_relaxation","sessionLevel":"L1"},"proof":{"type":"Ed25519Signature2020","created":"2025-08-12T00:00:00Z","verificationMethod":"did:example:issuer123#keys-1","proofPurpose":"assertionMethod","jws":"eyJhbGciOiJFZERTQSIsInR5cCI6IkpXVCJ9..."}}
